{
  "irVersion": "1.0",
  "project": "my-project",
  "repository": "https://github.com/example/my-project",
  "unreleased": {
    "added": [
      { "description": "New user profile page" }
    ]
  },
  "releases": [
    {
      "version": "1.1.0",
      "date": "2026-01-03",
      "added": [
        { "description": "Dark mode support" },
        { "description": "Export to PDF functionality" }
      ],
      "changed": [
        { "description": "Improved loading performance by 40%" }
      ],
      "fixed": [
        { "description": "Fixed crash on startup with empty config" }
      ]
    },
    {
      "version": "1.0.0",
      "date": "2025-12-01",
      "added": [
        { "description": "Initial release with core features" },
        { "description": "User authentication" },
        { "description": "Dashboard with analytics" }
      ]
    }
  ]
}
